{
  "version": "rava-action-v0",
  "id": "act_4895d1ad8dd04025cb89a68c3f530621",
  "nonce": "33333333-3333-4333-8333-333333333333",
  "actor": "rava:agent:ed4928c628d1c2c6eae9033890599561",
  "controller": "rava:human:8a88e3dd7409f195fd52db2d3cba5d72",
  "intent": "book_flight",
  "resource": "travel.booking",
  "operation": "purchase",
  "constraints": {
    "amount_usd": {
      "integer": 750
    }
  },
  "capability_id": "cap_faff91b4425d487f1f25c1599cea0be9",
  "context_hash": "sha256:2222222222222222222222222222222222222222222222222222222222222222",
  "proof": {
    "signature_hex": "d6cd2509480055f8b0f0064b53fbabffb5e4fdbe67488a751f7bde632377eb849b44c3a5df7a0148640787bc2e1d470b6b0a5d6e769809e8e3e5673f07c7a903"
  }
}